{
  "schema_version": 1,
  "generated_at": "2026-10-20",
  "base_url": "https://catalog.kazna.app",
  "packs": [
    {
      "id": "ru-home-improvement",
      "type": "payees",
      "version": 2,
      "name": {
        "en": "Russian Home Improvement",
        "ru": "Строительные магазины"
      },
      "description": {
        "en": "Home improvement and DIY stores in Russia — Lemana Pro, DOM Lenta (formerly OBI), Maxidom, Petrovich and more",
        "ru": "Строительные магазины и товары для дома — Лемана Про, DOM Лента (бывший ОБИ), Максидом, Петрович и другие"
      },
      "tags": ["russia", "home-improvement", "retail"],
      "entity_count": 6,
      "pack_url": "https://catalog.kazna.app/packs/ru-home-improvement/pack.json",
      "preview_logos": [
        "https://catalog.kazna.app/packs/ru-home-improvement/logos/lemana-pro.png",
        "https://catalog.kazna.app/packs/ru-home-improvement/logos/dom-lenta.png",
        "https://catalog.kazna.app/packs/ru-home-improvement/logos/maxidom.png",
        "https://catalog.kazna.app/packs/ru-home-improvement/logos/hoff.png"
      ]
    },
    {
      "id": "ru-online-services",
      "type": "payees",
      "version": 2,
      "name": {
        "en": "Russian Online Services",
        "ru": "Онлайн-сервисы России"
      },
      "description": {
        "en": "Russian digital services — Yandex ecosystem, VK, streaming platforms, Gosuslugi and more",
        "ru": "Российские цифровые сервисы — экосистема Яндекса, ВКонтакте, стриминг, Госуслуги и другие"
      },
      "tags": ["russia", "tech", "streaming", "apps"],
      "entity_count": 15,
      "pack_url": "https://catalog.kazna.app/packs/ru-online-services/pack.json",
      "preview_logos": [
        "https://catalog.kazna.app/packs/ru-online-services/logos/yandex-music.png",
        "https://catalog.kazna.app/packs/ru-online-services/logos/vk.png",
        "https://catalog.kazna.app/packs/ru-online-services/logos/kinopoisk.png",
        "https://catalog.kazna.app/packs/ru-online-services/logos/ivi.png"
      ]
    },
    {
      "id": "ru-supermarkets",
      "type": "payees",
      "version": 3,
      "name": {
        "en": "Russian Supermarkets",
        "ru": "Супермаркеты"
      },
      "description": {
        "en": "Major Russian grocery chains with logos — Pyaterochka, Magnit, Perekrestok, VkusVill and more",
        "ru": "Крупные сети продуктовых магазинов с логотипами — Пятёрочка, Магнит, Перекрёсток, ВкусВилл и другие"
      },
      "tags": ["russia", "groceries", "retail"],
      "entity_count": 17,
      "pack_url": "https://catalog.kazna.app/packs/ru-supermarkets/pack.json",
      "preview_logos": [
        "https://catalog.kazna.app/packs/ru-supermarkets/logos/pyaterochka.png",
        "https://catalog.kazna.app/packs/ru-supermarkets/logos/magnit.png",
        "https://catalog.kazna.app/packs/ru-supermarkets/logos/perekrestok.png"
      ]
    },
    {
      "id": "ru-food-delivery",
      "type": "payees",
      "version": 3,
      "name": {
        "en": "Russian Food Delivery",
        "ru": "Доставка еды"
      },
      "description": {
        "en": "Food delivery services operating in Russia — Yandex Eda, Delivery, Samokat and more",
        "ru": "Сервисы доставки еды в России — Яндекс Еда, Деливери, Самокат и другие"
      },
      "tags": ["russia", "food-delivery", "apps"],
      "entity_count": 7,
      "pack_url": "https://catalog.kazna.app/packs/ru-food-delivery/pack.json",
      "preview_logos": [
        "https://catalog.kazna.app/packs/ru-food-delivery/logos/yandex-eda.png",
        "https://catalog.kazna.app/packs/ru-food-delivery/logos/delivery-club.png",
        "https://catalog.kazna.app/packs/ru-food-delivery/logos/samokat.png",
        "https://catalog.kazna.app/packs/ru-food-delivery/logos/kuper.png"
      ]
    },
    {
      "id": "ru-marketplaces",
      "type": "payees",
      "version": 3,
      "name": {
        "en": "Russian Marketplaces",
        "ru": "Маркетплейсы"
      },
      "description": {
        "en": "Major Russian online marketplaces — Wildberries, Ozon, Yandex Market, MegaMarket and more",
        "ru": "Крупные российские маркетплейсы — Вайлдберриз, Озон, Яндекс Маркет, МегаМаркет и другие"
      },
      "tags": ["russia", "shopping", "retail"],
      "entity_count": 8,
      "pack_url": "https://catalog.kazna.app/packs/ru-marketplaces/pack.json",
      "preview_logos": [
        "https://catalog.kazna.app/packs/ru-marketplaces/logos/wildberries.png",
        "https://catalog.kazna.app/packs/ru-marketplaces/logos/ozon.png",
        "https://catalog.kazna.app/packs/ru-marketplaces/logos/yandex-market.png",
        "https://catalog.kazna.app/packs/ru-marketplaces/logos/megamarket.png"
      ]
    },
    {
      "id": "ru-mobile-operators",
      "type": "payees",
      "version": 3,
      "name": {
        "en": "Russian Mobile Operators",
        "ru": "Мобильные операторы"
      },
      "description": {
        "en": "Russian mobile operators and MVNOs — MTS, Beeline, Megafon, t2, Yota and more",
        "ru": "Российские мобильные операторы и MVNO — МТС, Билайн, МегаФон, t2, Йота и другие"
      },
      "tags": ["russia", "mobile", "telecom"],
      "entity_count": 9,
      "pack_url": "https://catalog.kazna.app/packs/ru-mobile-operators/pack.json",
      "preview_logos": [
        "https://catalog.kazna.app/packs/ru-mobile-operators/logos/mts.png",
        "https://catalog.kazna.app/packs/ru-mobile-operators/logos/beeline.png",
        "https://catalog.kazna.app/packs/ru-mobile-operators/logos/megafon.png",
        "https://catalog.kazna.app/packs/ru-mobile-operators/logos/tele2.png"
      ]
    },
    {
      "id": "global-brands",
      "type": "payees",
      "version": 2,
      "name": {
        "en": "Global Brands",
        "ru": "Мировые бренды"
      },
      "description": {
        "en": "Worldwide consumer brands — Amazon, Apple, Google, Netflix, McDonald's, IKEA and more",
        "ru": "Мировые потребительские бренды — Амазон, Эппл, Гугл, Нетфликс, Макдоналдс, ИКЕА и другие"
      },
      "tags": ["global", "retail", "tech", "food"],
      "entity_count": 21,
      "pack_url": "https://catalog.kazna.app/packs/global-brands/pack.json",
      "preview_logos": [
        "https://catalog.kazna.app/packs/global-brands/logos/amazon.png",
        "https://catalog.kazna.app/packs/global-brands/logos/mcdonalds.png",
        "https://catalog.kazna.app/packs/global-brands/logos/netflix.png",
        "https://catalog.kazna.app/packs/global-brands/logos/ikea.png"
      ]
    },
    {
      "id": "ru-banks",
      "type": "banks",
      "version": 9,
      "name": {
        "en": "Russian Banks",
        "ru": "Банки России"
      },
      "description": {
        "en": "Major Russian banks with card colors — Sberbank, T-Bank, VTB, Alfa-Bank and 57 more",
        "ru": "Крупные банки России с цветами карт — Сбербанк, Т-Банк, ВТБ, Альфа-Банк и ещё 57"
      },
      "tags": ["russia", "banks"],
      "entity_count": 61,
      "pack_url": "https://catalog.kazna.app/packs/ru-banks/pack.json",
      "preview_logos": [
        "https://catalog.kazna.app/packs/ru-banks/logos/sberbank.png",
        "https://catalog.kazna.app/packs/ru-banks/logos/tbank.png",
        "https://catalog.kazna.app/packs/ru-banks/logos/vtb.png",
        "https://catalog.kazna.app/packs/ru-banks/logos/alfabank.png"
      ]
    },
    {
      "id": "by-banks",
      "type": "banks",
      "version": 3,
      "name": {
        "en": "Belarusian Banks",
        "ru": "Банки Беларуси",
        "be": "Банкі Беларусі"
      },
      "description": {
        "en": "Major Belarusian banks — Belarusbank, Belagroprombank, Priorbank and more",
        "ru": "Крупные банки Беларуси — Беларусбанк, Белагропромбанк, Приорбанк и другие"
      },
      "tags": ["belarus", "banks"],
      "entity_count": 11,
      "pack_url": "https://catalog.kazna.app/packs/by-banks/pack.json",
      "preview_logos": [
        "https://catalog.kazna.app/packs/by-banks/logos/belarusbank.png",
        "https://catalog.kazna.app/packs/by-banks/logos/belagroprombank.png",
        "https://catalog.kazna.app/packs/by-banks/logos/priorbank.png"
      ]
    },
    {
      "id": "kz-banks",
      "type": "banks",
      "version": 3,
      "name": {
        "en": "Kazakh Banks",
        "ru": "Банки Казахстана",
        "kk": "Қазақстан банктері"
      },
      "description": {
        "en": "Major Kazakh banks — Kaspi Bank, Halyk Bank, CenterCredit and more",
        "ru": "Крупные банки Казахстана — Каспи Банк, Халык Банк, ЦентрКредит и другие"
      },
      "tags": ["kazakhstan", "banks"],
      "entity_count": 11,
      "pack_url": "https://catalog.kazna.app/packs/kz-banks/pack.json",
      "preview_logos": [
        "https://catalog.kazna.app/packs/kz-banks/logos/kaspi.png",
        "https://catalog.kazna.app/packs/kz-banks/logos/halyk.png",
        "https://catalog.kazna.app/packs/kz-banks/logos/centercredit.png"
      ]
    },
    {
      "id": "ua-banks",
      "type": "banks",
      "version": 3,
      "name": {
        "en": "Ukrainian Banks",
        "ru": "Банки Украины",
        "uk": "Банки України"
      },
      "description": {
        "en": "Major Ukrainian banks with card colors — Monobank, PrivatBank, Oschadbank, PUMB and 5 more",
        "ru": "Крупные банки Украины с цветами карт — Монобанк, ПриватБанк, Ощадбанк, ПУМБ и ещё 5"
      },
      "tags": ["ukraine", "banks"],
      "entity_count": 9,
      "pack_url": "https://catalog.kazna.app/packs/ua-banks/pack.json",
      "preview_logos": [
        "https://catalog.kazna.app/packs/ua-banks/logos/monobank.png",
        "https://catalog.kazna.app/packs/ua-banks/logos/privatbank.png"
      ]
    },
    {
      "id": "global-banks",
      "type": "banks",
      "version": 4,
      "name": {
        "en": "Global Banks",
        "ru": "Мировые банки"
      },
      "description": {